RazaoSocial;UF;TotalDespesas;MediaDespesasPorTrimestre;DesvioPadraoDespesas
UNIMED JOÃO MONLEVADE COOPERATIVA DE TRABALHO MÉDICO LTDA.;MG;171835955.68;57278651.89;3875456.19
UNIMED DE TATUI - COOPERATIVA DE TRABALHO MÉDICO;SP;170017315.58;56672438.53;2187689.61
UNIMED DE JABOTICABAL COOP. DE TRABALHO MÉDICO;SP;169782855.54;56594285.18;3192080.34
UNIMED LAVRAS COOPERATIVA DE TRABALHO MÉDICO;MG;168630712.96;56210237.65;2697827.55
UNIMED EXTREMO OESTE CATARINENSE COOPERATIVA DE TRABALHO MÉDICO;SC;168185603.51;56061867.84;2218657.15
UNIMED DE LORENA COOPERATIVA DE TRABALHO MÉDICO;SP;167574830.90;55858276.97;5226494.75
UNIMED CENTRO SUL FLUMINENSE COOPERATIVA DE TRABALHO MÉDICO;RJ;167495546.07;55831848.69;3098098.57
CAIXA DE ASSISTÊNCIA DOS SERVIDORES FAZENDÁRIOS ESTADUAIS;CE;167108484.68;55702828.23;30745174.30
UNIMED NORTE PIONEIRO - COOPERATIVA DE TRABALHO MÉDICO;PR;160537041.37;53512347.12;3273934.40
UNIMED FRONTEIRA NOROESTE/RS - COOPERATIVA DE ASSISTÊNCIA À SAÚDE LTDA.;RS;159914657.21;53304885.74;2555261.61
OESTE SAÚDE ASSISTÊNCIA A SAÚDE SUPLEMENTAR S.A;SP;159275545.73;53091848.58;8478150.94
ASSOCIAÇÃO BENEFICENTE DOS PROFESSORES PÚBLICOS ATIVOS E INATIVOS DO RIO DE JANEIRO - APPAI;RJ;159229813.43;53076604.48;28453350.32
CAIXA DE ASSISTÊNCIA À SAÚDE DOS SERVIDORES PÚBLICOS DO ESTADO DO MATO GROSSO DO SUL;MS;158227074.42;52742358.14;12461199.06
CAIXA DE ASSISTÊNCIA DOS EMPREGADOS DA SANEAGO;GO;157382827.88;52460942.63;30517523.55
FUNDAÇÃO DE SEGURIDADE SOCIAL DA ARCELORMITTAL BRASIL - FUNSSEST;ES;154395998.75;51465332.92;24781127.71
AGROS - INSTITUTO UFV DE SEGURIDADE SOCIAL;MG;153802313.06;51267437.69;19441193.49
ASSOCIAÇÃO SANTA CASA SAÚDE DE ARAÇATUBA;SP;153753344.78;51251114.93;2744244.44
UNIMED ARAGUARI COOPERATIVA DE TRABALHO MÉDICO;MG;153614091.69;51204697.23;3403895.15
SAÚDE SANTA TEREZA LTDA.;SP;153604162.91;51201387.64;11874537.16
OPERADORA UNICENTRAL DE PLANOS DE SAÚDE LTDA.;SP;151654074.60;50551358.20;6938562.89
ASSOCIAÇAO DOS FUNCIONARIOS PUBLICOS DO ESTADO DO RIO GRANDE DO SUL;RS;150835034.39;50278344.80;8306012.23
METLIFE PLANOS ODONTOLÓGICOS LTDA.;SP;148106532.03;49368844.01;15942142.52
SANTA CASA DE MAUÁ SAÚDE;SP;147531900.01;49177300.00;3063977.29
UNIMED ITUIUTABA COOPERATIVA TRABALHO MÉDICO LTDA.;MG;144982473.82;48327491.27;2291392.64
ELETROS SAÚDE - ASSOCIAÇÃO DE ASSISTÊNCIA À SAÚDE;RJ;144254841.31;48084947.10;7634926.49
UNIMED TRÊS RIOS COOPERATIVA DE TRABALHO MÉDICO;RJ;143732325.46;47910775.15;2896059.31
UNIMED ITAJUBA COOPERATIVA DE TRABALHO MEDICO;MG;143614657.64;47871552.55;3828689.54
UNIMED ALTA MOGIANA COOPERATIVA DE TRABALHO MÉDICO;SP;142700386.35;47566795.45;2842346.67
UNIMED ITAÚNA COOPERATIVA DE TRABALHO MÉDICO LTDA.;MG;142062757.08;47354252.36;2763219.01
ASSISTÊNCIA MÉDICA SÃO MIGUEL LTDA;SP;142014083.89;47338027.96;2556484.45
SAMI ASSISTÊNCIA MÉDICA LTDA;SP;141655650.89;47218550.30;19298469.03
COOPERATIVA DE TRABALHO MEDICO DE ARAGUAÍNA - UNIMED ARAGUAÍNA;TO;138704209.04;46234736.35;1520810.10
UNIMED DE GUARATINGUETA-COOPERATIVA DE TRABALHO MÉDICO;SP;137731566.42;45910522.14;3909156.79
VIVACOM PLANOS DE SAÚDE;GO;137289222.78;45763074.26;10651187.99
UNIMED VALE DAS ANTAS, RS - COOPERATIVA DE ASSISTÊNCIA À SAÚDE LTDA.;RS;136923002.54;45641000.85;3361829.98
CAIXA DE ASSISTÊNCIA DOS EMPREGADOS DO SISTEMA FINANCEIRO BANESTES;ES;136502854.02;45500951.34;13584879.85
UNIMED SAÚDE E ODONTO S.A;SP;136168667.44;45389555.81;11356563.81
UNIMED OESTE DO PARÁ - COOPERATIVA DE TRABALHO MÉDICO;PA;136042176.96;45347392.32;11246945.71
PARANA ASSISTENCIA MEDICA LTDA;PR;135407816.92;45135938.97;5636970.49
UNIMED SUL PAULISTA - COOPERATIVA DE TRABALHO MÉDICO;SP;134252990.43;44750996.81;3045209.97
TEMPO MED PLANO DE SAUDE LTDA;SC;133639690.18;44546563.39;4601403.41
ASSOCIAÇÃO DE ASSISTÊNCIA À SAÚDE DA AMAGIS;MG;132683142.21;44227714.07;12137468.63
IRMANDADE DA SANTA CASA DE MISERICORDIA DE LIMEIRA;SP;132507259.48;44169086.49;5401559.84
GARANTIA DE SAÚDE LTDA;SP;132163553.86;44054517.95;14718596.33
NOVA SAÚDE OPERADORA INTEGRADA DE SAÚDE LTDA;RJ;131535372.09;43845124.03;29163262.31
SULMED - ASSISTÊNCIA MÉDICA LTDA;RS;130735624.71;43578541.57;8211900.01
ESMALE ASSISTENCIA INTERNACIONAL DE SAUDE LTDA.;AL;130389989.32;43463329.77;13507217.75
COOPERATIVA DE TRABALHO MÉDICO DO PLANALTO NORTE DE SANTA CATARINA LTDA;SC;128215391.16;42738463.72;1326978.28
UNIODONTO DE CAMPINAS COOPERATIVA ODONTOLÓGICA;SP;127615844.25;42538614.75;7285632.81
UNIMED DE SOBRAL SOCIEDADE COOPERATIVA MÉDICA LTDA;CE;127147663.32;42382554.44;3378048.65
GOCARE PLANOS DE SAUDE LTDA;SP;124817850.15;41605950.05;5198207.04
ASSOCIAÇÃO DE SAÚDE DO VALE;SC;122362738.43;40787579.48;12626269.44
PLADISA PLANOS DE SAÚDE SA;SC;122312021.64;40770673.88;8362367.83
PLAMED PLANO DE ASSISTENCIA MEDICA LTDA;SE;121171687.29;40390562.43;13480680.89
AMHE MED ASSISTENCIA A SAUDE LTDA - EPP;SP;120612567.03;40204189.01;3943029.39
MATÃO CLINICAS & AMHMA SAÚDE LTDA;SP;119066504.46;39688834.82;5497591.47
BEST SENIOR OPERADORA DE SAÚDE LTDA;ES;117719337.13;39239779.04;8832161.76
UNIMED CENTRO PAULISTA - FEDERAÇÃO INTRAFEDERATIVA DAS COOPERATIVAS MÉDICAS;SP;117169193.72;39056397.91;10483782.28
PRONTOMED PLANOS DE SAÚDE LTDA;MG;116706968.18;38902322.73;7265202.04
FUNDACAO LEONOR DE BARROS CAMARGO;SP;116706558.40;38902186.13;9582629.09
ASSOCIAÇÃO POLICIAL DE ASSISTÊNCIA À SAÚDE;SP;116683970.15;38894656.72;1826750.44
UNIMED DE ANDRADINA - COOPERATIVA DE TRABALHO MÉDICO;SP;116411325.68;38803775.23;1386587.49
UNIMED GUAXUPÉ COOPERATIVA DE TRABALHO MEDICO;MG;115926956.74;38642318.91;1442496.32
VITA ASSISTÊNCIA A SAÚDE LTDA.;MG;115568137.09;38522712.36;4981196.26
ASSOCIAÇÃO DE SAÚDE DOS FORNECEDORES DE CANA DE PIRACICABA E REGIÃO;SP;115422240.27;38474080.09;8050556.68
SUL AMÉRICA ODONTOLÓGICO S/A;SP;115320585.09;38440195.03;6262291.86
UNIMED PATROCÍNIO COOPERATIVA DE TRABALHO MÉDICO LTDA.;MG;114894954.68;38298318.23;3469227.58
UNIMED DE IBITINGA COOPERATIVA DE TRABALHO MÉDICO;SP;114084890.03;38028296.68;2600837.21
CAIXA ASSISTENCIAL UNIVERSITÁRIA DO RIO GRANDE DO NORTE;RN;114005958.82;38001986.27;11376294.62
CAIXA DE ASSISTÊNCIA À SAUDE DOS EMPREGADOS DA CODEVASF - CASEC;DF;113370861.01;37790287.00;20344282.55
AMEPLAN ASSISTÊNCIA MÉDICA PLANEJADA LTDA;SP;112922790.17;37640930.06;2861770.43
ASSOCIAÇÃO DE ASSISTÊNCIA MÉDICO HOSPITALAR DOS MAGISTRADOS DO ESTADO DO PARANÁ;PR;111974923.48;37324974.49;7483720.03
UNIMED SÃO LOURENÇO COOPERATIVA DE TRABALHO MÉDICO;MG;111749913.19;37249971.06;1755957.12
UNIMED ALTO DA SERRA - SOCIEDADE COOPERATIVA DE SERVIÇO MÉDICO LTDA.;RS;111356975.03;37118991.68;1940053.37
UNIMED NORTE PAULISTA - COOPERATIVA DE TRABALHO MÉDICO;SP;109861978.62;36620659.54;1250888.97
UNIMED DE AVARÉ COOPERATIVA DE TRABALHO MÉDICO;SP;109521397.29;36507132.43;1351434.82
UNIMED COSTA VERDE RJ;RJ;109226275.76;36408758.59;2560495.08
SANTA CASA DE MISERICORDIA DE SAO JOAQUIM DA BARRA;SP;108971377.58;36323792.53;3595819.75
ASSOCIAÇÃO MINEIRA DE ASSISTÊNCIA À SAÚDE DOS MEMBROS DO MINISTÉRIO PÚBLICO;MG;108597203.43;36199067.81;17514676.80
UNIMED CAÇADOR COOPERATIVA DE TRABALHO MÉDICO DA REGIÃO DO CONTESTADO;SC;108339592.59;36113197.53;2462199.78
CAIXA DE ASSISTÊNCIA À SAÚDE DO SINDICATO DOS FUNCIONÁRIOS INTEGRANTES DO GRUPO OCUPACIONAL ADMINISTRAÇÃO TRIBUTÁRIA DO ESTADO DE PERNAMBUCO;PE;107477510.29;35825836.76;11517622.06
SÃO DOMINGOS SAÚDE- ASSISTÊNCIA MÉDICA  LTDA;SP;107464992.25;35821664.08;6151378.98
UNIMED DE BIRIGUI - COOPERATIVA DE TRABALHO MÉDICO;SP;106107221.63;35369073.88;1788410.14
ASSOCIAÇÃO DO PLANO DE SAÚDE DA SANTA CASA DE MISERICÓRDIA DE ITABUNA - PLANSUL;BA;105439253.92;35146417.97;3456181.52
AMHA SAUDE S/A;SP;104644848.76;34881616.25;8116356.56
UNIMED MARQUES DE VALENÇA COOPERATIVA DE TRABALHO MÉDICO LTDA.;RJ;104614173.87;34871391.29;1843804.46
UNIMED ALTO SÃO FRANCISCO COOPERATIVA DE TRABALHO MÉDICO;MG;104167332.85;34722444.28;1876033.21
SISTEMAS E PLANOS DE SAÚDE LTDA.;SP;103937544.18;34645848.06;16163567.01
CAIXA DE ASSISTÊNCIA DOS FUNCIONÁRIOS DO BANCO DA AMAZÔNIA - CASF;PA;103629830.36;34543276.79;6330406.07
UNIMED NOROESTE FLUMINENSE - COOPERATIVA DE TRABALHO MÉDICO LTDA;RJ;103306207.58;34435402.53;5407878.72
HOSPITAIS E CLÍNICAS DO PIAUÍ S/S LTDA;PI;102931097.99;34310366.00;6207022.87
FUNDAÇÃO LIBERTAS DE SEGURIDADE SOCIAL;MG;101370209.47;33790069.82;9336151.76
ASSOCIAÇÃO SAÚDE SÃO JOSÉ;SC;100029178.73;33343059.58;5221439.37
INSTITUIÇÃO BENEFICENTE CEL MASSOT - IBCM;RS;98913688.97;32971229.66;6325069.37
SÃO FRANCISCO ASSISTÊNCIA MÉDICA LTDA;PE;97870907.35;32623635.78;6179738.35
ASSOCIAÇÃO MAIS SAÚDE SANTA CASA DE SÃO JOÃO DA BOA VISTA;SP;96593314.10;32197771.37;8248617.67
DENTAL UNI - COOPERATIVA ODONTOLÓGICA;PR;92725327.44;30908442.48;6240551.11
UNIMED NORTE DO PARANÁ COOPERATIVA REGIONAL DE TRABALHO MÉDICO;PR;92651254.48;30883751.49;1406017.41
UNIMED SUDOESTE DE MINAS COOPERATIVA DE TRABALHO MÉDICO;MG;91792631.90;30597543.97;2827144.48
ASSOCIAÇÃO POLICIAL DE ASSISTÊNCIA À SAÚDE DE BAURU;SP;91766703.82;30588901.27;15684712.75
ASSOCIAÇÃO SÃO LUIZ SAÚDE;SP;91717430.84;30572476.95;6591243.16
UNIMED DE UBA COOPERATIVA DE TRABALHO MEDICO;MG;91497351.63;30499117.21;1715636.41
SAMOC S.A. - SOCIEDADE ASSISTENCIAL MÉDICA E ODONTO CIRÚRGICA;RJ;91474158.13;30491386.04;6281119.16
UNIMED VALE DO JAURU COOPERATIVA DE TRABALHO MÉDICO;MT;91067136.56;30355712.19;2978006.78
AMAZÔNIA PLANOS DE SAÚDE LTDA;PA;90607567.52;30202522.51;10541745.38
CAIXA DE ASSISTÊNCIA SISTEMA SAÚDE INTEGRAL-SSI SAUDE;RS;90539084.03;30179694.68;15197763.85
ÚNICA ASSISTENCIA MEDICA LTDA;SP;90035865.85;30011955.28;19063013.54
IRMANDADE DE MISERICÓRDIA DO HOSPITAL DA SANTA CASA DE MONTE ALTO;SP;89978220.51;29992740.17;4375677.74
UNIMED GURUPI COOPERATIVA DE TRABALHO MÉDICO;TO;89768742.44;29922914.15;1134837.74
UNIMED DE TAUBATÉ COOPERATIVA DE TRABALHO MÉDICO;SP;89639093.62;29879697.87;2339840.46
IRMANDADE DA SANTA CASA DE MISERICÓRDIA DE PASSOS;MG;87298069.51;29099356.50;2957695.41
ASSOCIAÇÃO FUNDO DE PROTEÇÃO À SAÚDE;PR;87200555.69;29066851.90;8265042.99
CAIXA DE ASSISTÊNCIA AOS MEMBROS DA DEFENSORIA PÚBLICA DO ESTADO DO RIO DE JANEIRO;RJ;86611416.50;28870472.17;6704641.48
UNIMED DE CAPIVARI -COOPERATIVA DE TRABALHO MÉDICO;SP;86466231.02;28822077.01;1347012.08
PLANO DE SAUDE ASES LTDA.;RJ;86378293.46;28792764.49;4208989.77
LEADER ASSISTÊNCIA MÉDICA E HOSPITALAR LTDA.;SP;85394287.78;28464762.59;2119873.79
UNIMED NOROESTE DE MINAS COOPERATIVA DE TRABALHO MEDICO LTDA;MG;83303367.25;27767789.08;1790649.15
UNIMED TRÊS CORAÇÕES COOPERATIVA DE TRABALHO MÉDICO LTDA.;MG;81876413.85;27292137.95;1723635.57
UNIMED CATAGUASES COOPERATIVA DE TRABALHO MÉDICO LTDA;MG;81613519.29;27204506.43;967026.79
ANAFE SAUDE;GO;81122122.60;27040707.53;10259942.36
UNIMED DE MINEIROS COOPERATIVA DE TRABALHO MÉDICO;GO;81000994.31;27000331.44;1762988.35
UNIMED DE BARRETOS COOPERATIVA DE TRABALHO MÉDICO;SP;80819958.63;26939986.21;1973068.32
UNIMED DE TUPA COOPERATIVA DE TRABALHO MÉDICO;SP;80638974.68;26879658.23;1223457.67
UNIMED VILHENA - COOPERATIVA DE TRABALHO MEDICO LTDA;RO;80389107.77;26796369.26;1698739.69
UNIMED INTRAFEDERATIVA FEDERAÇÃO REGIONAL SUL DE MINAS;MG;78708982.99;26236327.66;14361155.69
ASSOCIAÇÃO DOS AUDITORES FISCAIS DO ESTADO DA PARAÍBA - AFRAFEP;PB;78567423.02;26189141.01;16588229.74
UNIMED DE PIRASSUNUNGA COOPERATIVA DE TRABALHO MÉDICO;SP;77853885.77;25951295.26;2461307.91
ASSOCIAÇÃO DOS FUNCIONÁRIOS DO FISCO DO ESTADO DE GOIÁS;GO;77522620.19;25840873.40;12497832.52
UNIMED PONTAL DO TRIÂNGULO - COOPERATIVA DE TRABALHO MÉDICO;MG;77308063.04;25769354.35;1751398.01
UNIMED CARATINGA - COOPERATIVA DE TRABALHO MÉDICO LTDA;MG;76638984.24;25546328.08;1681060.84
SAÚDE BRASIL ASSISTÊNCIA MÉDICA LTDA.;SP;76487958.58;25495986.19;5422108.23
MAIS SAÚDE PLANO DE SAÚDE LTDA;GO;76270201.63;25423400.54;6795177.59
GS PLANO GLOBAL DE SAÚDE LTDA;RJ;75557174.58;25185724.86;3904523.81
UNIMED FRUTAL COOPERATIVA DE TRABALHO MEDICO LTDA;MG;75523564.44;25174521.48;913777.98
CONFERÊNCIA SÃO JOSÉ DO AVAÍ;RJ;75500542.00;25166847.33;3820098.40
SANTA CASA DE MISERICÓRDIA DE VOTUPORANGA;SP;75500407.37;25166802.46;3857889.93
UNITY SERVIÇOS INTEGRADOS DE SAÚDE LTDA.;DF;74783103.03;24927701.01;6686081.89
UNIMED VIÇOSA - COOPERATIVA DE TRABALHO MÉDICO;MG;73730866.40;24576955.47;1322625.92
IRMANDADE DE MISERICORDIA DE PORTO FERREIRA;SP;73679846.02;24559948.67;11130599.24
CAIXA DE ASSISTÊNCIA DOS EMPREGADOS DO BANEB;BA;72669812.09;24223270.70;6296893.46
OPERADORA DE PLANOS PRIVADOS DE SAÚDE - SANTA CASA SAÚDE LTDA;MS;72487211.88;24162403.96;4897768.24
INTERMEDICI PIRACICABA ASSISTENCIA MEDICA LTDA;SP;71072227.51;23690742.50;3665056.19
UNIMED DE MOCOCA COOPERATIVA DE TRAB. MÉDICO;SP;70531342.87;23510447.62;1654445.35
ASSOCIAÇÃO DO FISCO DE ALAGOAS;AL;69725674.60;23241891.53;10150918.20
UNIMED VALE DO PIQUIRI-COOPERATIVA DE TRABALHO MÉDICO VALE DO PIQUIRI;PR;69200216.66;23066738.89;2054569.96
UNIMED VERTENTE DO CAPARAÓ - COOPERATIVA DE TRABALHO MÉDICO LTDA;MG;68672165.73;22890721.91;1800133.64
UNIMED PLANALTO CENTRAL/RS - COOPERATIVA DE ASSISTÊNCIA  À SAÚDE LTDA.;RS;67843284.79;22614428.26;1309748.10
ASSOCIAÇÃO PARANAENSE DE ASSISTÊNCIA À SAUDE DOS MEMBROS DO MINISTERIO PUBLICO DO PARANÁ;PR;67536650.31;22512216.77;5987997.02
UNIMED DE SAO JOSÉ DO RIO PARDO-COOP. DE TRAB. MÉDICO;SP;67524417.62;22508139.21;1972486.60
FUNDAÇÃO FILANTRÓPICA E BENEFICENTE DE SAÚDE ARNALDO GAVAZZA FILHO;MG;67182066.51;22394022.17;2491594.75
CAIXA DE ASSISTÊNCIA DOS MAGISTRADOS DE PERNAMBUCO;PE;67106647.43;22368882.48;3930080.82
UNIMED-RIO COOPERATIVA DE TRABALHO MEDICO DO RIO DE JANEIRO;RJ;65480619.35;65480619.35;37805253.21
PLANO ODONTOLÓGICO DENTALVIDAS LTDA.;SP;64964948.84;21654982.95;11034732.36
BRASILDENTAL OPERADORA DE PLANOS ODONTOLÓGICOS S.A.;SP;63563719.97;21187906.66;7500171.02
UNIMED DE DRACENA - COOPERATIVA DE TRABALHO MÉDICO;SP;62085078.03;20695026.01;806470.95
UNIMED ALFENAS COOPERATIVA DE TRABALHO MEDICO;MG;61772509.59;20590836.53;2170515.39
UNIMED REGIÃO DA CAMPANHA/RS - COOPERATIVA DE ASSISTÊNCIA À SAÚDE LTDA.;RS;61631205.80;20543735.27;1153298.98
UNIMED REGIÃO DA PRODUÇÃO/RS - COOPERATIVA DE ASSISTÊNCIA À SAÚDE LTDA;RS;61158874.58;20386291.53;1420051.02
POLI SAUDE OPERADORA DE PLANO DE SAUDE LTDA;PR;61136771.16;20378923.72;3435343.44
UNIODONTO DE SÃO JOSÉ DOS CAMPOS COOPERATIVA DE TRABALHO ODONTOLÓGICO;SP;60168652.93;20056217.64;3259560.38
UNIMED SÃO SEBASTIÃO DO PARAÍSO COOPERATIVA DE TRABALHO MÉDICO;MG;60089909.99;20029970.00;1181606.85
AMEP FREGUESIA OPERADORA DE PLANO DE SAUDE LTDA;RJ;59139684.90;19713228.30;5779266.66
FUNDAÇÃO DE ASSISTÊNCIA À SAÚDE DA ASSOCIAÇÃO DO MINISTÉRIO PÚBLICO DO RIO GRANDE DO SUL;RS;58421076.13;19473692.04;8818685.45
UNIMED LEOPOLDINA COOPERATIVA DE TRABALHO MÉDICO LTDA;MG;58145648.25;19381882.75;1796854.35
UNIMED ALTO JACUÍ/RS - COOPERATIVA DE ASSISTÊNCIA À SAÚDE LTDA;RS;57332330.02;19110776.67;1165216.95
PREVIDENT ASSISTÊNCIA ODONTOLÓGICA S.A;SP;57278051.49;19092683.83;4367497.57
UNIMED DE ADAMANTINA-COOPERATIVA DE TRABALHO MÉDICO;SP;57156270.84;19052090.28;648001.46
AMPARA ASSISTÊNCIA MÉDICA PARAÍSO LTDA;MG;54195328.34;18065109.45;2179801.55
TERRAMAR ADMINISTRADORA DE PLANO DE SAUDE LTDA;BA;53745153.35;17915051.12;9991952.74
UNIMED CALDAS NOVAS - COOPERATIVA DE TRABALHO MEDICO;GO;53693619.76;17897873.25;1853138.73
CAIXA DE ASSISTÊNCIA DOS EMPREGADOS DO BANESE;SE;53148231.40;17716077.13;9655790.66
ASSOCIAÇÃO POLICIAL DE ASSISTÊNCIA À SAÚDE DE RIBEIRÃO PRETO (APAS);SP;53001580.43;17667193.48;2094337.79
SF SISTEMAS DE SAÚDE LTDA;SP;52972915.62;17657638.54;996752.70
FEDERAÇÃO DAS SOCIEDADES COOPERATIVAS DE TRABALHO MÉDICO DO ACRE, AMAPÁ, AMAZONAS, PARÁ, RONDONIA E RORAIMA;AM;51261694.46;51261694.46;3986813.97
ASSOCIAÇÃO PLANO DE SAÚDE SANTA CASA DE VALINHOS;SP;51019148.82;17006382.94;966002.83
PLAMER PLANO MEDICO RESENDE LTDA;RJ;50748580.66;16916193.55;701672.76
ASSOCIAÇÃO DOS AUDITORES FISCAIS DA RECEITA ESTADUAL DO RIO DE JANEIRO;RJ;50207864.92;16735954.97;4406851.41
UNIMED VALE DO URUCUIA - COOPERATIVA DE TRABALHO MEDICO LTDA;MG;49377059.65;16459019.88;6487580.77
PRONTOCLINICA E HOSPITAIS SAO LUCAS S/A;MG;48067308.74;16022436.25;1389174.43
UNIMED PATOS - COOPERATIVA DE TRABALHO MÉDICO;PB;47638550.40;15879516.80;1859736.94
FILOSANITAS SAUDE LTDA;SP;47390800.28;15796933.43;2519495.21
SBC SAÚDE LTDA.;SP;47302717.37;15767572.46;4527097.34
IRMANDADE DA SANTA CASA DE MISERICÓRDIA E MATERNIDADE DONA ZILDA SALVAGNI;SP;46880520.58;15626840.19;2394399.53
UNIMED TRÊS PONTAS - COOPERATIVA DE TRABALHO MÉDICO;MG;46279310.79;15426436.93;1117777.94
SOCIEDADE BENEFICENTE DEZOITO DE JULHO;MG;46245657.62;15415219.21;4497681.52
UNIMED DE MONTE ALTO - COOPERATIVA DE TRABALHO MÉDICO;SP;45873562.08;15291187.36;1107164.74
ASSOCIAÇÃO DOS EMPREGADOS DA COMPANHIA ESTADUAL DE HABITAÇÃO E OBRAS PÚBLICAS - ASSEC;SE;45557752.58;15185917.53;8636885.17
ASSOCIAÇÃO SAÚDE CONCEIÇÃO;SC;45491923.23;15163974.41;5086204.18
UNIODONTO BELÉM - COOPERATIVA DE ASSISTÊNCIA À SAÚDE ODONTOLÓGICA;PA;45453179.27;15151059.76;2229496.43
UNIMED VALE DO CORUMBÁ COOPERATIVA DE TRABALHO MEDICO;GO;45236148.47;15078716.16;1812743.72
ASSOCIACAO DOS PROFESSORES UNIVERSITÁRIOS DA BAHIA;BA;44913714.73;14971238.24;4127325.75
UNIMED REGIÃO DA FRONTEIRA - RS COOPERATIVA DE ASSISTÊNCIA À SAÚDE LTDA.;RS;44732045.26;14910681.75;1187683.10
FUNDACAO CAPITAL PREVIDENCIA E SAUDE - CAPITAL PREV;ES;44582374.95;22291187.47;4567179.03
UNIMED CACERES COOPERATIVA DE TRABALHO MÉDICO;MT;44039444.05;14679814.68;727370.38
UNIMED DE REGISTRO COOPERATIVA DE TRABALHO MÉDICO;SP;43718937.15;14572979.05;696485.89
ASSOCIAÇÃO POLICIAL DE ASSISTÊNCIA À SAÚDE DE ARAÇATUBA (APAS);SP;43619201.24;14539733.75;7240408.35
ADVANCE PLANOS DE SAÚDE LTDA;SP;43161916.91;14387305.64;6522623.05
TRINO - ALIANCA FILANTRÓPICA DE ASSISTÊNCIA E INTEGRAÇÃO PARA O DESENVOLVIMENTO DA SAUDE;ES;42990769.08;14330256.36;7791284.14
UNIMED DE CORUMBA COOPERATIVA DE TRABALHO MÉDICO;MS;42481996.39;14160665.46;2185601.09
SANTA CASA DE MISERICORDIA HOSPITAL SÃO VICENTE;SP;42439862.32;14146620.77;3542567.49
ASSOCIAÇÃO POLICIAL DE ASSISTÊNCIA A SAÚDE DA BAIXADA SANTISTA;SP;42196759.14;14065586.38;6910781.00
FEDERAÇÃO DAS COOP ODONTOLÓGICAS DO ESTADO DE SANTA CATARINA;SC;42115563.08;14038521.03;4398243.96
ASSOCIAÇÃO SANTA CASA CLÍNICAS DE BIRIGUI;SP;42018281.78;14006093.93;2231232.24
UNIX SAÚDE S.A;BA;41840490.34;13946830.11;2296555.66
UNIMED REGIONAL DE FLORIANO - COOPERATIVA DE TRABALHO MÉDICO;PI;41384636.01;13794878.67;1960275.04
ATÍVIA SERVIÇOS DE SAÚDE S/A;SP;41183754.04;20591877.02;1238612.03
SV SAUDE ADMINSTRADORES DE PLANO DE SAUDE LTDA;RJ;40958658.87;13652886.29;4400494.07
ASSOCIAÇÃO GOIANA DO MINISTÉRIO PÚBLICO;GO;40906531.97;13635510.66;6241256.99
UNIMED DE PENAPOLIS - COOPERATIVA DE TRABALHO MEDICO;SP;40355147.72;13451715.91;638337.14
PB ASSISTENCIA MEDICA EU LTDA;BA;37967613.98;12655871.33;4156344.24
COOPERATIVA DOS USUÁRIOS DE SERVIÇOS DE SAÚDE DO VALE DO RIO DOS SINOS LTDA;RS;37957621.89;12652540.63;6596068.81
EVANGELICO SAUDE LTDA.;PR;37912531.60;12637510.53;1833671.82
BIO SAÚDE SERVIÇOS MÉDICOS LTDA;SP;36947461.65;12315820.55;4384914.51
UNIMED PONTE NOVA COOPERATIVA DE TRABALHO MEDICO LTDA;MG;36813536.46;12271178.82;1401004.52
AME VVIDA PLANOS DE SAUDE INTEGRADO LTDA.;RO;36574055.19;12191351.73;7891988.14
PESSOAL SAÚDE PLANOS DE ASSISTÊNCIA MÉDICA LTDA;SP;36502126.28;12167375.43;827448.21
CAIXA DE ASSISTÊNCIA DO SINDFISCO - CASSIND;SE;36330123.13;12110041.04;5653293.27
UNIMED SUDOESTE PAULISTA COOPERATIVA DE TRABALHO MÉDICO;SP;36281325.51;12093775.17;1030862.94
UNIMED VALE DO CARANGOLA COOPERATIVA DE TRABALHO MEDICO LTDA;MG;36011671.03;12003890.34;1101971.11
MAIS SAUDE S/A;ES;35975543.97;17987771.98;4613823.89
UNIMED DE JATAÍ COOPERATIVA DE TRABALHO MÉDICO LTDA.;GO;35818953.65;11939651.22;406178.92
SOCIEDADE PORTUGUESA DE BENEFICÊNCIA;RS;35498555.13;11832851.71;1814913.04
COOPERATIVA DOS USUÁRIOS DE SERVIÇOS DE SAÚDE LTDA.;RS;35178256.10;11726085.37;3339617.58
ASSOCIAÇÃO VALEPARAIBANA DE ASSISTÊNCIA MÉDICA POLICIAL;SP;34974160.34;11658053.45;4763812.61
DESBAN - FUNDAÇÃO BDMG DE SEGURIDADE SOCIAL;MG;34495979.21;11498659.74;3580574.22
UNIODONTO DE FORTALEZA COOPERATIVA DE TRABALHO ODONTOLOGICO LTDA;CE;34494408.32;11498136.11;2431345.25
SANTA CASA DE MISERICÓRDIA E BENEFICÊNCIA PORTUGUESA;SP;33129026.43;11043008.81;3429177.01
UNIMED CAJAZEIRAS - SOCIEDADE COOPERATIVA DE TRABALHO MÉDICO;PB;32674037.79;10891345.93;4402416.55
UNIMED SÃO JOÃO NEPOMUCENO COOPERATIVA DE TRABALHO MÉDICO LTDA.;MG;32116558.03;10705519.34;957131.46
HOSPITAL DE PRONTOCLINICA LTDA.;RS;32034317.08;10678105.69;2485016.87
UNIODONTO REGIONAL COOPERATIVA ODONTOLOGICA;MG;31864670.96;10621556.99;2094907.99
UNIMED MACHADO COOPERATIVA DE TRABALHO MEDICO;MG;31791924.61;10597308.20;694782.39
UNIMED DO OESTE DA BAHIA COOPERATIVA DE TRABALHO MÉDICO;BA;30821381.49;10273793.83;1388246.89
VIDA TOP MAIS SAÚDE OPERADORA DE PLANOS DE SAÚDE LTDA.;SP;30551795.50;10183931.83;2896358.41
FUNASA SAÚDE;PB;30367580.68;10122526.89;2147087.04
AURORA SAÚDE LTDA;MG;30269982.01;10089994.00;3345466.32
ASSOCIAÇAO UNISAUDE MARAU;RS;30177843.88;10059281.29;3017585.61
UNIODONTO MACEIÓ COOPERATIVA ODONTOLÓGICA;AL;29921359.64;9973786.55;6198210.98
UNIODONTO DE SC COOPERATIVA ADMINISTRADORA DE CONTRATOS;SC;29879898.01;9959966.00;1840764.97
UNIODONTO PORTO ALEGRE COOPERATIVA ODONTOLOGICA LTDA;RS;29539713.22;9846571.07;2306681.41
UNIODONTO/RN - COOPERATIVA ODONTOLOGICA DO RIO GRANDE DO NORTE;RN;29289543.99;9763181.33;1943028.80
UNIODONTO GOIANIA COOPERATIVA DE CIRURGIÕES DENTISTAS;GO;29217103.79;9739034.60;1115099.41
TOTAL ASSISTÊNCIA MÉDICA HOSPITALAR LTDA;MG;29199042.19;9733014.06;4014625.88
UNIDENTIS ASSISTENCIA ODONTOLOGICA LTDA.;PB;29196064.20;9732021.40;2188849.39
UNIODONTO PIRACICABA - COOPERATIVA ODONTOLÓGICA;SP;28695001.43;9565000.48;2269434.75
SANTA CASA DE SAÚDE - SCS;ES;28484463.98;9494821.33;1588899.00
CARE PLUS ODONTOLOGIA ASSISTENCIAL LTDA.;SP;28359822.29;9453274.10;3246924.87
ASSOCIACAO POLICIAL DE ASSISTENCIA A SAUDE DE PRESIDENTE PRUDENTE (APAS);SP;27555899.83;9185299.94;4379637.00
ATITUDE SAÚDE ASSISTÊNCIA MEDICA LTDA;BA;26869399.24;8956466.41;2744310.30
NACIONAL ODONTO OPERADORA DE PLANOS ODONTOLÓGICOS LTDA.;PE;26549343.14;8849781.05;2244059.67
RIO DOCE SAÚDE;ES;26517170.42;8839056.81;2282311.67
UNIMED MORRINHOS COOPERATIVA DE TRABALHO MEDICO;GO;25994527.99;8664842.66;784682.09
UNIMED CAMPO BELO- COOPERATIVA DE TRABALHO MÉDICO;MG;24828891.72;8276297.24;488215.48
ASSOCIAÇÃO POLICIAL DE ASSISTÊNCIA A SAÚDE;SP;22827004.36;7609001.45;4184707.12
ON MED ASSISTÊNCIA MÉDICA LTDA;RS;22312156.95;7437385.65;2409733.45
FUNDAÇÃO PLAMHUV - PLANO MÉDICO HOSPITALAR DOS HOSPITAIS UNIDOS DE VIÇOSA;MG;22021778.01;7340592.67;1379683.30
R.M.I. OPERADORA DE SAÚDE INTEGRADA LTDA;SP;22021317.66;11010658.83;3010322.91
ODONTO EMPRESAS CONVENIOS DENTARIOS LTDA.;SP;22015664.16;7338554.72;2434772.82
UNIODONTO DE JOÃO PESSOA COOPERATIVA ODONTOLÓGICA;PB;21920489.07;7306829.69;2010232.25
UNIODONTO DO BRASIL CENTRAL NACIONAL DAS COOPERATIVAS ODONTÓLOGICAS;SP;21618581.06;7206193.69;1587678.76
UNIODONTO DE MANAUS - COOPERATIVA ODONTOLÓGICA LTDA.;AM;21499594.14;7166531.38;1033835.66
CAIXA DE ASSISTÊNCIA À SAÚDE DOS TRABALHADORES NAS INDÚSTRIAS METALÚRGICAS, MECÂNICAS E DO MATERIAL ELÉTRICO DE BRUSQUE;SC;21480416.27;7160138.76;4577687.84
UNIMED REGIONAL DE PICOS - COOPERATIVA DE TRABALHO MÉDICO;PI;20973384.56;6991128.19;3476210.74
ODONTOGROUP SISTEMA DE SAÚDE LTDA.;DF;20729802.23;6909934.08;3269733.92
SOCIEDADE DE ASSISTÊNCIA MÉDICA - SAMEISA;RS;20678070.35;6892690.12;3522801.64
SUL DO PARÁ LTDA;PA;20652958.63;6884319.54;3919996.79
UNIMED SOUSA - COOPERATIVA DE TRABALHO MÉDICO;PB;20159402.14;6719800.71;933855.39
VIVENTERIS LTDA;PR;20070080.44;6690026.81;488536.29
UNIODONTO PAULISTA-FEDERAÇÃO DAS COOPERATIVAS ODONTOLÓGICAS DO ESTADO DE SÃO PAULO;SP;20038530.09;6679510.03;1396157.80
ASSOCIACAO DE SAUDE HOLAMBRA;SP;19804339.03;6601446.34;484546.37
CAIXA ASSISTENCIAL UNIVERSITARIA DO RIO DE JANEIRO;RJ;19661734.36;6553911.45;3075510.82
ASSOCIAÇÃO DOS FUNCIONÁRIOS FISCAIS DO ESTADO DO AMAZONAS - AFFEAM;AM;19492540.62;6497513.54;3145366.47
ANGELI SISTEMAS DE SAUDE S.A.;PR;19257623.44;6419207.81;1761175.95
ASSOCIAÇÃO DOS SERVIDORES MUNICIPAIS, ESTADUAIS E FEDERAIS DO RIO DE JANEIRO;RJ;18606757.95;6202252.65;2245209.92
UNIMED VALE DO PARAÍBA - FEDERAÇÃO INTRAFEDERATIVA DAS COOPERATIVAS MÉDICAS;SP;18509054.79;6169684.93;2327265.31
HOSPITAL CESAR LEITE;MG;18433410.83;6144470.28;831173.30
ASSOCIAÇÃO POLICIAL DE ASSISTENCIA À SAUDE DE SAO JOAO DA BOA VISTA;SP;17438805.79;5812935.26;3739764.40
HOSPITAL S.P. LTDA.;RS;17254605.51;5751535.17;1609029.31
CONFIANÇA ASSISTÊNCIA MÉDICO HOSPITALAR LTDA;MG;17141595.19;5713865.06;2395537.06
ASSOCIAÇÃO BENEFICENTE CATÓLICA;MG;16828337.77;5609445.92;539110.16
OPLAN SAÚDE OPERADORA DE PLANO DE SAÚDE LTDA;RJ;16788737.68;5596245.89;1126872.71
UNIODONTO DE AMERICANA COOPERATIVA ODONTOLÓGICA;SP;16444561.43;5481520.48;1046320.45
SISTEMA TOTAL DE SAÚDE LTDA.;SP;16042399.78;5347466.59;1311917.87
PLANO ASSISTENCIAL SÃO LUCAS LTDA;MG;15686824.99;5228941.66;1895943.14
PRIMA VIDA ODONTOLOGIA DE GRUPO LIMITADA;RJ;15498256.75;5166085.58;887233.33
PRONTO SOCORRO CONDE DE MOREIRA LIMA;SP;15413702.07;5137900.69;620153.85
PLAMESC PLANOS DE SAÚDE LTDA;RJ;14977119.50;4992373.17;794809.20
AME-ASSISTÊNCIA MÉDICA A EMPRESAS LTDA;MG;14756499.16;4918833.05;964577.88
FUNDO DE ASSISTÊNCIA À SAÚDE DOS FUNCIONÁRIOS DO BEC;CE;14549612.41;4849870.80;2860532.95
MEDIC GLOBAL PLANOS DE SAÚDE LTDA.;MG;14479551.60;4826517.20;1060450.86
